{
  "messageId": "MSG-20251224-001",
  "eventType": "PAYMENT_CREATED",
  "timestamp": "2025-12-24T14:30:00",
  "payload": {
    "customerId": "CUST-5678",
    "customerName": "Jane Smith",
    "email": "jane.smith@example.com",
    "phone": "+447911123456",
    "amount": 250.75,
    "currency": "GBP",
    "description": "Online purchase - Electronics",
    "active": true
  },
  "metadata": {
    "source": "web-app",
    "version": "v2.1",
    "region": "EU-WEST"
  }
}
